{
  "$schema": "https://zerostack.local/schemas/engine-topology-v1.schema.json",
  "schema_version": "1",
  "topology_id": "zerostack.engine-topology",
  "status": "accepted-for-migration",
  "source_repositories": [
    {
      "id": "zerostack",
      "name": "ZeroStack",
      "cargo_manifest": "Cargo.toml",
      "branch": "main",
      "role": "contract-hub"
    },
    {
      "id": "tokenzero",
      "name": "TokenZero",
      "cargo_manifest": "Cargo.toml",
      "branch": "main",
      "role": "domain-engine"
    },
    {
      "id": "fszero",
      "name": "FSZero",
      "cargo_manifest": "Cargo.toml",
      "branch": "main",
      "role": "domain-engine"
    },
    {
      "id": "graphzero",
      "name": "GraphZero",
      "cargo_manifest": "Cargo.toml",
      "branch": "main",
      "role": "domain-engine"
    }
  ],
  "hub": {
    "repository": "zerostack",
    "workspace_manifest": "Cargo.toml",
    "crates": [
      {
        "name": "zero-abi",
        "path": "crates/zero-abi",
        "role": "hub-foundation",
        "status": "keep"
      },
      {
        "name": "zero-cert",
        "path": "crates/zero-cert",
        "role": "hub-foundation",
        "status": "keep"
      },
      {
        "name": "zero-codemode",
        "path": "crates/zero-codemode",
        "role": "host-and-worker-adapter",
        "status": "keep"
      },
      {
        "name": "zero-gate",
        "path": "crates/zero-gate",
        "role": "hub-foundation",
        "status": "keep"
      },
      {
        "name": "zero-gauge",
        "path": "crates/zero-gauge",
        "role": "hub-foundation",
        "status": "keep"
      },
      {
        "name": "zero-ledger",
        "path": "crates/zero-ledger",
        "role": "hub-foundation",
        "status": "keep"
      },
      {
        "name": "zero-ref",
        "path": "crates/zero-ref",
        "role": "hub-foundation",
        "status": "keep"
      },
      {
        "name": "zero-store",
        "path": "crates/zero-store",
        "role": "hub-foundation",
        "status": "keep"
      },
      {
        "name": "zero-testkit",
        "path": "crates/zero-testkit",
        "role": "hub-foundation",
        "status": "keep"
      },
      {
        "name": "zerostack-machine-permit",
        "path": "crates/zerostack-machine-permit",
        "role": "hub-foundation",
        "status": "keep"
      }
    ],
    "binaries": [
      {
        "name": "zerostack-codemode-host",
        "package": "zero-codemode",
        "path": "crates/zero-codemode/src/bin/zerostack-codemode-host.rs",
        "role": "aggregate-host",
        "status": "keep"
      },
      {
        "name": "zerostack-codemode-conformance",
        "package": "zerostack-codemode-conformance",
        "path": "conformance/src/main.rs",
        "role": "public-interface-conformance",
        "status": "keep"
      },
      {
        "name": "raw_worker_v2",
        "package": "zerostack-fuzz",
        "path": "archive/pruned-20260730/fuzz/fuzz_targets/raw_worker_v2.rs",
        "role": "historical-fuzzer",
        "status": "quarantine"
      }
    ],
    "build_commands": [
      {
        "id": "hub-workspace-check",
        "runner": "rch",
        "program": "cargo",
        "args": [
          "check",
          "--locked",
          "--workspace",
          "--all-targets"
        ],
        "working_directory": "zerostack",
        "purpose": "Validate hub through isolated RCH",
        "env": {
          "CARGO_TARGET_DIR": ".rch-target/zerostack"
        }
      },
      {
        "id": "hub-host-release",
        "runner": "rch",
        "program": "cargo",
        "args": [
          "build",
          "--locked",
          "--release",
          "-p",
          "zero-codemode",
          "--bin",
          "zerostack-codemode-host"
        ],
        "working_directory": "zerostack",
        "purpose": "Build aggregate host",
        "env": {
          "CARGO_TARGET_DIR": ".rch-target/zerostack"
        }
      }
    ]
  },
  "canonical_engine_skeleton": {
    "roles": [
      {
        "id": "domain-core",
        "required": true,
        "package_pattern": "<engine>-core or existing domain crates",
        "binary_pattern": null,
        "owner": "engine"
      },
      {
        "id": "raw-worker",
        "required": true,
        "package_pattern": "<engine>-worker",
        "binary_pattern": "<engine>-codemode",
        "owner": "engine"
      },
      {
        "id": "cli",
        "required": true,
        "package_pattern": "<engine>-cli",
        "binary_pattern": "<engine>",
        "owner": "engine"
      },
      {
        "id": "test-support",
        "required": true,
        "package_pattern": "<engine>-test-support",
        "binary_pattern": null,
        "owner": "engine"
      },
      {
        "id": "optional-developer-tool",
        "required": false,
        "package_pattern": "<engine>-xtask or verification package",
        "binary_pattern": "tool-specific",
        "owner": "engine"
      }
    ],
    "feature_policy": {
      "worker_default_features": [],
      "worker_forbidden_features": [
        "quickjs",
        "js",
        "surface-mcp",
        "mcp-catalog",
        "planner",
        "nested-codemode",
        "harness-routing"
      ],
      "host_feature_owner": "zero-codemode",
      "adapter_feature_owner": "hub-adapter-package"
    },
    "binary_policy": {
      "cli_suffix": "",
      "worker_suffix": "-codemode",
      "shipping_binaries": [
        "<engine>",
        "<engine>-codemode"
      ]
    },
    "host_client_contract": {
      "name": "zerostack-host-client-v1",
      "entrypoint": "zerostack-codemode-host",
      "stability": "public-versioned",
      "reference_bridge": "hub-owned"
    }
  },
  "dependency_direction": {
    "layers": [
      {
        "id": "hub-foundation",
        "may_depend_on": [
          "declared-lower-layer"
        ],
        "must_not_depend_on": [
          "private-upper-layer"
        ]
      },
      {
        "id": "hub-host",
        "may_depend_on": [
          "declared-lower-layer"
        ],
        "must_not_depend_on": [
          "private-upper-layer"
        ]
      },
      {
        "id": "engine-domain",
        "may_depend_on": [
          "declared-lower-layer"
        ],
        "must_not_depend_on": [
          "private-upper-layer"
        ]
      },
      {
        "id": "engine-worker",
        "may_depend_on": [
          "declared-lower-layer"
        ],
        "must_not_depend_on": [
          "private-upper-layer"
        ]
      },
      {
        "id": "harness-adapter",
        "may_depend_on": [
          "declared-lower-layer"
        ],
        "must_not_depend_on": [
          "private-upper-layer"
        ]
      },
      {
        "id": "conformance",
        "may_depend_on": [
          "declared-lower-layer"
        ],
        "must_not_depend_on": [
          "private-upper-layer"
        ]
      }
    ],
    "allowed_edges": [
      {
        "from": "hub-host",
        "to": "hub-foundation"
      },
      {
        "from": "hub-host",
        "to": "hub-worker-adapter"
      },
      {
        "from": "engine-domain",
        "to": "hub-contract"
      },
      {
        "from": "engine-domain",
        "to": "hub-accounting"
      },
      {
        "from": "engine-worker",
        "to": "engine-domain"
      },
      {
        "from": "engine-worker",
        "to": "hub-worker-adapter"
      },
      {
        "from": "harness-adapter",
        "to": "hub-host-client"
      },
      {
        "from": "conformance",
        "to": "engine-worker-public-interface"
      }
    ],
    "forbidden_edges": [
      {
        "from": "engine-worker",
        "to": "planner"
      },
      {
        "from": "engine-worker",
        "to": "QuickJS"
      },
      {
        "from": "engine-worker",
        "to": "MCP-catalog"
      },
      {
        "from": "engine-worker",
        "to": "nested-CodeMode"
      },
      {
        "from": "engine-domain",
        "to": "harness-adapter"
      },
      {
        "from": "harness-adapter",
        "to": "engine-private"
      },
      {
        "from": "engine-domain",
        "to": "other-engine-private"
      },
      {
        "from": "conformance",
        "to": "engine-private-files"
      }
    ]
  },
  "raw_worker_v2": {
    "protocol": "raw-worker-v2",
    "required_capabilities": [
      "engine-identity",
      "contract-digest",
      "bounded-io",
      "deadline",
      "cancellation",
      "typed-errors",
      "durable-refs"
    ],
    "required_fields": [
      "protocol_version",
      "engine_identity",
      "contract_digest",
      "request_id",
      "operation",
      "deadline",
      "cancellation",
      "store_root",
      "response_or_typed_error"
    ],
    "prohibitions": [
      "planner",
      "QuickJS-runtime",
      "MCP-catalog",
      "harness-discovery",
      "nested-CodeMode",
      "Pi-routing",
      "unbounded-child-process",
      "hidden-async-tail",
      "journal-bypass",
      "cancellation-bypass",
      "RACC-bypass",
      "typed-failure-bypass",
      "private-protocol"
    ],
    "runtime_owner": "zerostack-codemode-host",
    "unknown_fields": "versioned",
    "skew_policy": "fail-closed"
  },
  "harness_adapters": [
    {
      "id": "plain-cli",
      "kind": "plain-cli",
      "entrypoint": "zerostack-codemode-host",
      "transport": "stdio/public-host-client",
      "owns": [
        "argument-parsing",
        "terminal-rendering",
        "exit-code-mapping"
      ],
      "depends_on": [
        "hub-host-client",
        "hub-artifact-manifest",
        "hub-reference-bridge"
      ],
      "must_not_import": [
        "engine-private-runtime",
        "Pi-internals",
        "copied-worker-protocol"
      ],
      "status": "thin-adapter"
    },
    {
      "id": "mcp-claude-code",
      "kind": "mcp-claude-code",